{
  "version": 1,
  "user_pub": "03a34b99f22c790c4e36b2b3c2c35a36db06226e41c692fc82b8b56ac1c540c5bd",
  "state_root": "3f7b4c2a1e8d9f6b5c4a3d2e1f0b9c8d7e6f5a4b3c2d1e0f9b8a7c6d5e4f3a2b",
  "timestamp": 1699862400,
  "policy_id": "a1b2c3d4e5f6a7b8c9d0e1f2a3b4c5d6e7f8a9b0c1d2e3f4a5b6c7d8e9f0a1b2",
  "anchor_txref": "abc123def456:0",
  "meta": {
    "batch_id": "batch_001",
    "user_email_hash": "e3b0c44298fc1c149afbf4c8996fb92427ae41e4649b934ca495991b7852b855"
  },
  "sig_alg": "ML-DSA",
  "sig": "deadbeef0123456789abcdef0123456789abcdef0123456789abcdef0123456789abcdef0123456789abcdef0123456789abcdef0123456789abcdef01234567",
  "sig_pub": "0123456789abcdef0123456789abcdef0123456789abcdef0123456789abcdef0123456789abcdef0123456789abcdef0123456789abcdef0123456789abcdef"
}
